{
  "generated_at": "2026-08-01T15:47:13Z",
  "item_count": 6,
  "period": {
    "end": "2026-08-01T16:00:00Z",
    "start": "2026-08-01T15:00:00Z"
  },
  "report_id": "hourly:2026-08-01T15:00:00Z",
  "sections": [
    {
      "heading": "AI 安全相关",
      "item_ids": [
        "itm_346dcb789958234b",
        "itm_12e914a045da0e00",
        "itm_d0cae5c10649436b"
      ],
      "summary": "AI 安全相关 本次共有 3 条内容进入公开数据，详见对应 Markdown 深读稿。"
    },
    {
      "heading": "大模型 Agent 相关",
      "item_ids": [
        "itm_6ad6a0c44c9ff949",
        "itm_abd9ce0a27ace175",
        "itm_17a7d982701ab252"
      ],
      "summary": "大模型 Agent 相关 本次共有 3 条内容进入公开数据，详见对应 Markdown 深读稿。"
    }
  ],
  "summary": "本小时 public data 由 finalize-public-run 机械更新，共收录 6 条内容。",
  "top_item_ids": [
    "itm_6ad6a0c44c9ff949",
    "itm_abd9ce0a27ace175",
    "itm_346dcb789958234b",
    "itm_17a7d982701ab252",
    "itm_12e914a045da0e00"
  ],
  "version": 1
}
