{
  "generated_at": "2026-07-30T12:58:00Z",
  "item_count": 5,
  "period": {
    "end": "2026-07-30T13:00:00Z",
    "start": "2026-07-30T12:00:00Z"
  },
  "report_id": "hourly:2026-07-30T12:00:00Z",
  "sections": [
    {
      "heading": "AI 安全相关",
      "item_ids": [
        "itm_abc2033559b9a694",
        "itm_520e55e8ef6ca599"
      ],
      "summary": "AI 安全相关 本次共有 2 条内容进入公开数据，详见对应 Markdown 深读稿。"
    },
    {
      "heading": "大模型 Agent 相关",
      "item_ids": [
        "itm_09c456e3a31ef32c",
        "itm_ddd6798f93c508ca"
      ],
      "summary": "大模型 Agent 相关 本次共有 2 条内容进入公开数据，详见对应 Markdown 深读稿。"
    },
    {
      "heading": "大模型后训练相关",
      "item_ids": [
        "itm_543d33da7a34bea3"
      ],
      "summary": "大模型后训练相关 本次共有 1 条内容进入公开数据，详见对应 Markdown 深读稿。"
    }
  ],
  "summary": "本小时 public data 由 finalize-public-run 机械更新，共收录 5 条内容。",
  "top_item_ids": [
    "itm_abc2033559b9a694",
    "itm_09c456e3a31ef32c",
    "itm_ddd6798f93c508ca",
    "itm_543d33da7a34bea3",
    "itm_520e55e8ef6ca599"
  ],
  "version": 1
}
