{
  "generated_at": "2026-06-11T08:41:54Z",
  "item_count": 4,
  "period": {
    "end": "2026-06-11T09:00:00Z",
    "start": "2026-06-11T08:00:00Z"
  },
  "report_id": "hourly:2026-06-11T08:00:00Z",
  "sections": [
    {
      "heading": "AI 安全相关",
      "item_ids": [
        "itm_eaa9dfbc3e58ff42",
        "itm_7707e44cbf4aecfd"
      ],
      "summary": "AI 安全相关 本次共有 2 条内容进入公开数据，详见对应 Markdown 深读稿。"
    },
    {
      "heading": "大模型后训练相关",
      "item_ids": [
        "itm_c98e43e588156c5a",
        "itm_457cbf3d581cb014"
      ],
      "summary": "大模型后训练相关 本次共有 2 条内容进入公开数据，详见对应 Markdown 深读稿。"
    }
  ],
  "summary": "本小时 public data 由 finalize-public-run 机械更新，共收录 4 条内容。",
  "top_item_ids": [
    "itm_eaa9dfbc3e58ff42",
    "itm_c98e43e588156c5a",
    "itm_7707e44cbf4aecfd",
    "itm_457cbf3d581cb014"
  ],
  "version": 1
}
