{
  "generated_at": "2026-10-17T20:56:00Z",
  "item_count": 2,
  "period": {
    "end": "2026-10-17T21:00:00Z",
    "start": "2026-10-17T20:00:00Z"
  },
  "report_id": "hourly:2026-10-17T20:00:00Z",
  "sections": [
    {
      "heading": "大模型后训练相关",
      "item_ids": [
        "itm_1b53ffa20545983f",
        "itm_e26e68f0fd27bf94"
      ],
      "summary": "大模型后训练相关 本次共有 2 条内容进入公开数据，详见对应 Markdown 深读稿。"
    }
  ],
  "summary": "本小时 public data 由 finalize-public-run 机械更新，共收录 2 条内容。",
  "top_item_ids": [
    "itm_1b53ffa20545983f",
    "itm_e26e68f0fd27bf94"
  ],
  "version": 1
}
