{
  "generated_at": "2026-06-19T04:12:10Z",
  "item_count": 5,
  "period": {
    "end": "2026-06-19T05:00:00Z",
    "start": "2026-06-19T04:00:00Z"
  },
  "report_id": "hourly:2026-06-19T04:00:00Z",
  "sections": [
    {
      "heading": "AI 安全相关",
      "item_ids": [
        "itm_81017cf15299a194",
        "itm_3660e3e2e2ec1dcb"
      ],
      "summary": "AI 安全相关 本次共有 2 条内容进入公开数据，详见对应 Markdown 深读稿。"
    },
    {
      "heading": "大模型 Agent 相关",
      "item_ids": [
        "itm_757c1abbe8aca051",
        "itm_283071ed5a15d434",
        "itm_e6559019fcc3542c"
      ],
      "summary": "大模型 Agent 相关 本次共有 3 条内容进入公开数据，详见对应 Markdown 深读稿。"
    }
  ],
  "summary": "本小时 public data 由 finalize-public-run 机械更新，共收录 5 条内容。",
  "top_item_ids": [
    "itm_81017cf15299a194",
    "itm_757c1abbe8aca051",
    "itm_283071ed5a15d434",
    "itm_3660e3e2e2ec1dcb",
    "itm_e6559019fcc3542c"
  ],
  "version": 1
}
