{
  "generated_at": "2026-07-22T10:48:32Z",
  "item_count": 5,
  "period": {
    "end": "2026-07-22T11:00:00Z",
    "start": "2026-07-22T10:00:00Z"
  },
  "report_id": "hourly:2026-07-22T10:00:00Z",
  "sections": [
    {
      "heading": "AI 安全相关",
      "item_ids": [
        "itm_707a25b1dc8eef2b",
        "itm_5d0782fb9515516d",
        "itm_a8c2a680fdfba2bf"
      ],
      "summary": "AI 安全相关 本次共有 3 条内容进入公开数据，详见对应 Markdown 深读稿。"
    },
    {
      "heading": "大模型 Agent 相关",
      "item_ids": [
        "itm_aead1422774aae94",
        "itm_0df6c63220aac1f3"
      ],
      "summary": "大模型 Agent 相关 本次共有 2 条内容进入公开数据，详见对应 Markdown 深读稿。"
    }
  ],
  "summary": "本小时 public data 由 finalize-public-run 机械更新，共收录 5 条内容。",
  "top_item_ids": [
    "itm_707a25b1dc8eef2b",
    "itm_5d0782fb9515516d",
    "itm_aead1422774aae94",
    "itm_0df6c63220aac1f3",
    "itm_a8c2a680fdfba2bf"
  ],
  "version": 1
}
