{
  "generated_at": "2026-07-23T17:16:18Z",
  "item_count": 6,
  "period": {
    "end": "2026-07-23T18:00:00Z",
    "start": "2026-07-23T17:00:00Z"
  },
  "report_id": "hourly:2026-07-23T17:00:00Z",
  "sections": [
    {
      "heading": "AI 安全相关",
      "item_ids": [
        "itm_5243724d4c88e32e",
        "itm_1c2398dbd85a7aa2",
        "itm_a0a8472b96312f9b",
        "itm_c547aebb431f7b6e"
      ],
      "summary": "AI 安全相关 本次共有 4 条内容进入公开数据，详见对应 Markdown 深读稿。"
    },
    {
      "heading": "大模型 Agent 相关",
      "item_ids": [
        "itm_0f141660b0e432bc"
      ],
      "summary": "大模型 Agent 相关 本次共有 1 条内容进入公开数据，详见对应 Markdown 深读稿。"
    },
    {
      "heading": "大模型后训练相关",
      "item_ids": [
        "itm_b0c5fe88ec6126c7"
      ],
      "summary": "大模型后训练相关 本次共有 1 条内容进入公开数据，详见对应 Markdown 深读稿。"
    }
  ],
  "summary": "本小时 public data 由 finalize-public-run 机械更新，共收录 6 条内容。",
  "top_item_ids": [
    "itm_5243724d4c88e32e",
    "itm_0f141660b0e432bc",
    "itm_1c2398dbd85a7aa2",
    "itm_a0a8472b96312f9b",
    "itm_b0c5fe88ec6126c7"
  ],
  "version": 1
}
