{
  "generated_at": "2026-07-06T19:31:32Z",
  "item_count": 7,
  "period": {
    "end": "2026-07-06T20:00:00Z",
    "start": "2026-07-06T19:00:00Z"
  },
  "report_id": "hourly:2026-07-06T19:00:00Z",
  "sections": [
    {
      "heading": "AI 安全相关",
      "item_ids": [
        "itm_882eeb673729bce0",
        "itm_5c12acb77a5354d0",
        "itm_cdb0e6f785877d48"
      ],
      "summary": "AI 安全相关 本次共有 3 条内容进入公开数据，详见对应 Markdown 深读稿。"
    },
    {
      "heading": "大模型 Agent 相关",
      "item_ids": [
        "itm_6b6b0eb97d17da21"
      ],
      "summary": "大模型 Agent 相关 本次共有 1 条内容进入公开数据，详见对应 Markdown 深读稿。"
    },
    {
      "heading": "大模型后训练相关",
      "item_ids": [
        "itm_5be9399afd59e582",
        "itm_0db831c2b5b31898",
        "itm_8f1ed8e1219adbae"
      ],
      "summary": "大模型后训练相关 本次共有 3 条内容进入公开数据，详见对应 Markdown 深读稿。"
    }
  ],
  "summary": "本小时 public data 由 finalize-public-run 机械更新，共收录 7 条内容。",
  "top_item_ids": [
    "itm_882eeb673729bce0",
    "itm_5be9399afd59e582",
    "itm_5c12acb77a5354d0",
    "itm_0db831c2b5b31898",
    "itm_6b6b0eb97d17da21"
  ],
  "version": 1
}
