{
  "generated_at": "2026-07-18T04:59:03Z",
  "item_count": 2,
  "period": {
    "end": "2026-07-18T05:00:00Z",
    "start": "2026-07-18T04:00:00Z"
  },
  "report_id": "hourly:2026-07-18T04:00:00Z",
  "sections": [
    {
      "heading": "AI 安全相关",
      "item_ids": [
        "itm_083c2a53e8e4aaa5"
      ],
      "summary": "AI 安全相关 本次共有 1 条内容进入公开数据，详见对应 Markdown 深读稿。"
    },
    {
      "heading": "大模型 Agent 相关",
      "item_ids": [
        "itm_392f4880f1fe570a"
      ],
      "summary": "大模型 Agent 相关 本次共有 1 条内容进入公开数据，详见对应 Markdown 深读稿。"
    }
  ],
  "summary": "本小时 public data 由 finalize-public-run 机械更新，共收录 2 条内容。",
  "top_item_ids": [
    "itm_392f4880f1fe570a",
    "itm_083c2a53e8e4aaa5"
  ],
  "version": 1
}
