{
  "generated_at": "2026-07-05T01:13:23Z",
  "item_count": 1,
  "period": {
    "end": "2026-07-05T02:00:00Z",
    "start": "2026-07-05T01:00:00Z"
  },
  "report_id": "hourly:2026-07-05T01:00:00Z",
  "sections": [
    {
      "heading": "大模型 Agent 相关",
      "item_ids": [
        "itm_d325f38ce2140ef1"
      ],
      "summary": "大模型 Agent 相关 本次共有 1 条内容进入公开数据，详见对应 Markdown 深读稿。"
    }
  ],
  "summary": "本小时 public data 由 finalize-public-run 机械更新，共收录 1 条内容。",
  "top_item_ids": [
    "itm_d325f38ce2140ef1"
  ],
  "version": 1
}
