{
  "generated_at": "2026-08-22T18:43:37Z",
  "item_count": 4,
  "period": {
    "end": "2026-08-22T19:00:00Z",
    "start": "2026-08-22T18:00:00Z"
  },
  "report_id": "hourly:2026-08-22T18:00:00Z",
  "sections": [
    {
      "heading": "AI 安全相关",
      "item_ids": [
        "itm_04f88334eb46888a"
      ],
      "summary": "AI 安全相关 本次共有 1 条内容进入公开数据，详见对应 Markdown 深读稿。"
    },
    {
      "heading": "大模型 Agent 相关",
      "item_ids": [
        "itm_97f36cd2d53a57ad",
        "itm_6ebc4819a672d73f"
      ],
      "summary": "大模型 Agent 相关 本次共有 2 条内容进入公开数据，详见对应 Markdown 深读稿。"
    },
    {
      "heading": "大模型后训练相关",
      "item_ids": [
        "itm_ceb4afa34405a782"
      ],
      "summary": "大模型后训练相关 本次共有 1 条内容进入公开数据，详见对应 Markdown 深读稿。"
    }
  ],
  "summary": "本小时 public data 由 finalize-public-run 机械更新，共收录 4 条内容。",
  "top_item_ids": [
    "itm_04f88334eb46888a",
    "itm_ceb4afa34405a782",
    "itm_97f36cd2d53a57ad",
    "itm_6ebc4819a672d73f"
  ],
  "version": 1
}
