{
  "generated_at": "2026-08-15T10:21:54Z",
  "item_count": 4,
  "period": {
    "end": "2026-08-15T11:00:00Z",
    "start": "2026-08-15T10:00:00Z"
  },
  "report_id": "hourly:2026-08-15T10:00:00Z",
  "sections": [
    {
      "heading": "AI 安全相关",
      "item_ids": [
        "itm_a3c13a3fa24d5a26"
      ],
      "summary": "AI 安全相关 本次共有 1 条内容进入公开数据，详见对应 Markdown 深读稿。"
    },
    {
      "heading": "大模型 Agent 相关",
      "item_ids": [
        "itm_5a5a274c27a298da",
        "itm_2ecfd69ec17c33f7"
      ],
      "summary": "大模型 Agent 相关 本次共有 2 条内容进入公开数据，详见对应 Markdown 深读稿。"
    },
    {
      "heading": "大模型后训练相关",
      "item_ids": [
        "itm_921fa18089ec0b6c"
      ],
      "summary": "大模型后训练相关 本次共有 1 条内容进入公开数据，详见对应 Markdown 深读稿。"
    }
  ],
  "summary": "本小时 public data 由 finalize-public-run 机械更新，共收录 4 条内容。",
  "top_item_ids": [
    "itm_921fa18089ec0b6c",
    "itm_a3c13a3fa24d5a26",
    "itm_5a5a274c27a298da",
    "itm_2ecfd69ec17c33f7"
  ],
  "version": 1
}
