{
  "generated_at": "2026-07-13T03:49:57Z",
  "item_count": 1,
  "period": {
    "end": "2026-07-13T04:00:00Z",
    "start": "2026-07-13T03:00:00Z"
  },
  "report_id": "hourly:2026-07-13T03:00:00Z",
  "sections": [
    {
      "heading": "AI 安全相关",
      "item_ids": [
        "itm_548a1dce054f7c85"
      ],
      "summary": "AI 安全相关 本次共有 1 条内容进入公开数据，详见对应 Markdown 深读稿。"
    }
  ],
  "summary": "本小时 public data 由 finalize-public-run 机械更新，共收录 1 条内容。",
  "top_item_ids": [
    "itm_548a1dce054f7c85"
  ],
  "version": 1
}
