{
  "generated_at": "2026-08-03T10:03:37Z",
  "item_count": 3,
  "period": {
    "end": "2026-08-03T11:00:00Z",
    "start": "2026-08-03T10:00:00Z"
  },
  "report_id": "hourly:2026-08-03T10:00:00Z",
  "sections": [
    {
      "heading": "AI 安全相关",
      "item_ids": [
        "itm_7d6f5f88b2e5ae54",
        "itm_012833b3ed2842de",
        "itm_664d77c00d333697"
      ],
      "summary": "AI 安全相关 本次共有 3 条内容进入公开数据，详见对应 Markdown 深读稿。"
    }
  ],
  "summary": "本小时 public data 由 finalize-public-run 机械更新，共收录 3 条内容。",
  "top_item_ids": [
    "itm_7d6f5f88b2e5ae54",
    "itm_012833b3ed2842de",
    "itm_664d77c00d333697"
  ],
  "version": 1
}
