{
  "generated_at": "2026-10-16T14:42:20Z",
  "item_count": 5,
  "period": {
    "end": "2026-10-16T15:00:00Z",
    "start": "2026-10-16T14:00:00Z"
  },
  "report_id": "hourly:2026-10-16T14:00:00Z",
  "sections": [
    {
      "heading": "AI 安全相关",
      "item_ids": [
        "itm_eabdba3d0ecd0e18"
      ],
      "summary": "AI 安全相关 本次共有 1 条内容进入公开数据，详见对应 Markdown 深读稿。"
    },
    {
      "heading": "大模型 Agent 相关",
      "item_ids": [
        "itm_a51e3c14f3ab4588",
        "itm_e47342c1f32a4cef",
        "itm_9a173d46c7216564"
      ],
      "summary": "大模型 Agent 相关 本次共有 3 条内容进入公开数据，详见对应 Markdown 深读稿。"
    },
    {
      "heading": "大模型后训练相关",
      "item_ids": [
        "itm_b828a308c17e39f5"
      ],
      "summary": "大模型后训练相关 本次共有 1 条内容进入公开数据，详见对应 Markdown 深读稿。"
    }
  ],
  "summary": "本小时 public data 由 finalize-public-run 机械更新，共收录 5 条内容。",
  "top_item_ids": [
    "itm_b828a308c17e39f5",
    "itm_a51e3c14f3ab4588",
    "itm_e47342c1f32a4cef",
    "itm_9a173d46c7216564",
    "itm_eabdba3d0ecd0e18"
  ],
  "version": 1
}
