{
  "generated_at": "2026-07-27T17:58:32Z",
  "item_count": 6,
  "period": {
    "end": "2026-07-27T18:00:00Z",
    "start": "2026-07-27T17:00:00Z"
  },
  "report_id": "hourly:2026-07-27T17:00:00Z",
  "sections": [
    {
      "heading": "AI 安全相关",
      "item_ids": [
        "itm_d7fd46c49138c499"
      ],
      "summary": "AI 安全相关 本次共有 1 条内容进入公开数据，详见对应 Markdown 深读稿。"
    },
    {
      "heading": "大模型 Agent 相关",
      "item_ids": [
        "itm_ef5cbaec4e698e1c",
        "itm_691ff88ab0dc7300"
      ],
      "summary": "大模型 Agent 相关 本次共有 2 条内容进入公开数据，详见对应 Markdown 深读稿。"
    },
    {
      "heading": "大模型后训练相关",
      "item_ids": [
        "itm_75a4b74e8b0fa52b",
        "itm_ad1c18c4d9ea2084",
        "itm_127b808f16db7bdc"
      ],
      "summary": "大模型后训练相关 本次共有 3 条内容进入公开数据，详见对应 Markdown 深读稿。"
    }
  ],
  "summary": "本小时 public data 由 finalize-public-run 机械更新，共收录 6 条内容。",
  "top_item_ids": [
    "itm_d7fd46c49138c499",
    "itm_ef5cbaec4e698e1c",
    "itm_691ff88ab0dc7300",
    "itm_75a4b74e8b0fa52b",
    "itm_ad1c18c4d9ea2084"
  ],
  "version": 1
}
